{
  "profile_version": "0.1",
  "profile_id": "soc2-2024",
  "framework": {
    "name": "SOC2",
    "version": "2024",
    "description": "SOC 2 Type II compliance profile for AI agent systems, focusing on security, availability, and confidentiality"
  },
  "rules": {
    "identity": {
      "required_fields": ["agent_version", "deployment_context"],
      "allowed_contexts": ["staging", "production"],
      "requires_version": true
    },
    "tool_layer": {
      "max_severity": "medium",
      "requires_tool_inventory": true,
      "blocked_permissions": [
        "filesystem:write unrestricted",
        "network:external unrestricted",
        "system:execute arbitrary"
      ],
      "blocked_sources": ["unverified-external", "unknown"]
    },
    "risk_layer": {
      "requires_risk_assessment": true,
      "max_unmitigated_critical": 0,
      "max_unmitigated_high": 2,
      "requires_mitigation_for": ["critical", "high"]
    },
    "attestation": {
      "requires_signature": true,
      "requires_timestamp": true
    }
  },
  "metadata": {
    "author": "WasmAgent",
    "created_at": "2026-07-07T00:00:00Z",
    "updated_at": "2026-07-07T00:00:00Z",
    "documentation_url": "https://www.aicpa.org/soc4so"
  }
}
